{
  "id": "q20",
  "question": "归属区划在云南省本级以外的缴款有多少？",
  "status": "answer",
  "metrics_hit": [
    {
      "measures": [
        "fiscal_collection_view.count",
        "fiscal_collection_view.amt"
      ],
      "dimensions": [
        "fiscal_collection_view.rec_rgn_code",
        "fiscal_collection_view.rec_rgn_name"
      ]
    }
  ],
  "sql": "SELECT `fiscal_collection`.`frecrgncode` `fiscal_collection_view__rec_rgn_code`, `fiscal_collection`.rec_rgn_name_canon `fiscal_collection_view__rec_rgn_name`, count(*) `fiscal_collection_view__count`, sum(`fiscal_collection`.`famt`) `fiscal_collection_view__amt` \nFROM  (SELECT * FROM (\n  SELECT * FROM (\n    SELECT * FROM (\n      SELECT * FROM (\n        SELECT t.*, c.chg_agency_name_canon FROM fne_paybook_full_high t\n        LEFT JOIN (SELECT fchgagencode,\n                          arrayStringConcat(arraySort(groupUniqArray(fchgagenname)), ' / ') AS chg_agency_name_canon\n                   FROM fne_paybook_full_high GROUP BY fchgagencode) c ON t.fchgagencode = c.fchgagencode\n      ) x1\n      LEFT JOIN (SELECT frecrgncode,\n                        arrayStringConcat(arraySort(groupUniqArray(frecrgnname)), ' / ') AS rec_rgn_name_canon\n                 FROM fne_paybook_full_high WHERE frecrgncode != '' GROUP BY frecrgncode) r ON x1.frecrgncode = r.frecrgncode\n    ) x2\n    LEFT JOIN (SELECT fitemcode,\n                      arrayStringConcat(arraySort(groupUniqArray(fitemname)), ' / ') AS item_name_canon\n               FROM fne_paybook_full_high WHERE fitemcode != '' GROUP BY fitemcode) i ON x2.fitemcode = i.fitemcode\n  ) x3\n  LEFT JOIN (SELECT fsubcode,\n                    arrayStringConcat(arraySort(groupUniqArray(fsubname)), ' / ') AS sub_name_canon\n             FROM fne_paybook_full_high WHERE fsubcode != '' GROUP BY fsubcode) s ON x3.fsubcode = s.fsubcode\n) x4\nLEFT JOIN (SELECT frecsubcode,\n                  arrayStringConcat(arraySort(groupUniqArray(frecsubname)), ' / ') AS rec_sub_name_canon\n           FROM fne_paybook_full_high WHERE frecsubcode != '' GROUP BY frecsubcode) rs ON x4.frecsubcode = rs.frecsubcode\n)  AS `fiscal_collection`\nWHERE (`fiscal_collection`.`frecrgncode` <> ? OR `fiscal_collection`.`frecrgncode` IS NULL)\nGROUP BY 1, 2\nORDER BY  4  DESC\nLIMIT 100530000",
  "sql_count": 1,
  "answer": "口径声明：缴款金额取 fiscal_collection_view.amt（明细合计），归属区划取收入归属 rec_rgn_code/rec_rgn_name；'云南省本级'=编码 530000（数据成员面名称即云南省本级，词典无既有约定、ai_context 唯一编码口径直接采用）。'省本级以外'按 rec_rgn_code≠530000 过滤，归属区划为空的 553 笔（23.15 亿）计入'以外'。数据范围：全量 1281 笔、18,332,267,287.91 元，其中省本级 686 笔、16,016,434,579.21 元；省本级以外合计 595 笔、2,315,832,708.70 元（约 23.16 亿元），明细分组共 5 组（上表，按金额降序），未截断。注意：'以外'金额 87.6% 来自归属区划为空的记录，若空值不应计入请拍板后另查。",
  "errors": [],
  "elapsed_s": 33.0,
  "arbiter": null,
  "raw_path": "rounds/m0/runs/cube/q20.raw.json"
}