{
  "id": "q12",
  "question": "今年通过直缴方式缴款的资金总额是多少？",
  "status": "answer",
  "metrics_hit": [
    {
      "measures": [
        "fiscal_collection_view.amt"
      ],
      "dimensions": []
    }
  ],
  "sql": "SELECT sum(`fiscal_collection`.`famt`) `fiscal_collection_view__amt` \nFROM  (SELECT * FROM (\n  SELECT * FROM (\n    SELECT * FROM (\n      SELECT * FROM (\n        SELECT t.*, c.chg_agency_name_canon FROM fne_paybook_full_high t\n        LEFT JOIN (SELECT fchgagencode,\n                          arrayStringConcat(arraySort(groupUniqArray(fchgagenname)), ' / ') AS chg_agency_name_canon\n                   FROM fne_paybook_full_high GROUP BY fchgagencode) c ON t.fchgagencode = c.fchgagencode\n      ) x1\n      LEFT JOIN (SELECT frecrgncode,\n                        arrayStringConcat(arraySort(groupUniqArray(frecrgnname)), ' / ') AS rec_rgn_name_canon\n                 FROM fne_paybook_full_high WHERE frecrgncode != '' GROUP BY frecrgncode) r ON x1.frecrgncode = r.frecrgncode\n    ) x2\n    LEFT JOIN (SELECT fitemcode,\n                      arrayStringConcat(arraySort(groupUniqArray(fitemname)), ' / ') AS item_name_canon\n               FROM fne_paybook_full_high WHERE fitemcode != '' GROUP BY fitemcode) i ON x2.fitemcode = i.fitemcode\n  ) x3\n  LEFT JOIN (SELECT fsubcode,\n                    arrayStringConcat(arraySort(groupUniqArray(fsubname)), ' / ') AS sub_name_canon\n             FROM fne_paybook_full_high WHERE fsubcode != '' GROUP BY fsubcode) s ON x3.fsubcode = s.fsubcode\n) x4\nLEFT JOIN (SELECT frecsubcode,\n                  arrayStringConcat(arraySort(groupUniqArray(frecsubname)), ' / ') AS rec_sub_name_canon\n           FROM fne_paybook_full_high WHERE frecsubcode != '' GROUP BY frecsubcode) rs ON x4.frecsubcode = rs.frecsubcode\n)  AS `fiscal_collection`\nWHERE (toDateOrNull(`fiscal_collection`.`fdate`) >= parseDateTimeBestEffort(?) AND toDateOrNull(`fiscal_collection`.`fdate`) <= parseDateTimeBestEffort(?)) AND (`fiscal_collection`.`fbustype` = ?)\nORDER BY  1  DESC\nLIMIT 1002026-01-01T00:00:00.000Z2026-12-31T23:59:59.999Z1",
  "sql_count": 1,
  "answer": "口径：直缴 = bus_type='1'（口径词典 2026-10-22 用户拍板，非静默选择）；金额为缴款明细金额 amt；时间范围 2026-01-01 至 2026-12-31，按缴款日期 pay_date 过滤。查询返回 1 行全量汇总，无截断，总额 17689.82 元。",
  "errors": [],
  "elapsed_s": 140.4,
  "arbiter": null,
  "raw_path": "rounds/round-02/runs/cube/q12.raw.json"
}