{
  "id": "q19",
  "question": "各收款银行（代理银行）2022 年各收了多少笔、多少钱？",
  "status": "answer",
  "metrics_hit": [
    {
      "measures": [
        "fiscal_collection_view.paybook_count",
        "fiscal_collection_view.amt"
      ],
      "dimensions": [
        "fiscal_collection_view.rec_bank_code"
      ]
    }
  ],
  "sql": "SELECT `fiscal_collection`.`frecbankcode` `fiscal_collection_view__rec_bank_code`, COUNT(DISTINCT `fiscal_collection`.`fpaycode`) `fiscal_collection_view__paybook_count`, sum(`fiscal_collection`.`famt`) `fiscal_collection_view__amt` \nFROM  (SELECT * FROM (\n  SELECT * FROM (\n    SELECT * FROM (\n      SELECT * FROM (\n        SELECT t.*, c.chg_agency_name_canon FROM fne_paybook_full_high t\n        LEFT JOIN (SELECT fchgagencode,\n                          arrayStringConcat(arraySort(groupUniqArray(fchgagenname)), ' / ') AS chg_agency_name_canon\n                   FROM fne_paybook_full_high GROUP BY fchgagencode) c ON t.fchgagencode = c.fchgagencode\n      ) x1\n      LEFT JOIN (SELECT frecrgncode,\n                        arrayStringConcat(arraySort(groupUniqArray(frecrgnname)), ' / ') AS rec_rgn_name_canon\n                 FROM fne_paybook_full_high WHERE frecrgncode != '' GROUP BY frecrgncode) r ON x1.frecrgncode = r.frecrgncode\n    ) x2\n    LEFT JOIN (SELECT fitemcode,\n                      arrayStringConcat(arraySort(groupUniqArray(fitemname)), ' / ') AS item_name_canon\n               FROM fne_paybook_full_high WHERE fitemcode != '' GROUP BY fitemcode) i ON x2.fitemcode = i.fitemcode\n  ) x3\n  LEFT JOIN (SELECT fsubcode,\n                    arrayStringConcat(arraySort(groupUniqArray(fsubname)), ' / ') AS sub_name_canon\n             FROM fne_paybook_full_high WHERE fsubcode != '' GROUP BY fsubcode) s ON x3.fsubcode = s.fsubcode\n) x4\nLEFT JOIN (SELECT frecsubcode,\n                  arrayStringConcat(arraySort(groupUniqArray(frecsubname)), ' / ') AS rec_sub_name_canon\n           FROM fne_paybook_full_high WHERE frecsubcode != '' GROUP BY frecsubcode) rs ON x4.frecsubcode = rs.frecsubcode\n)  AS `fiscal_collection`\nWHERE (toDateOrNull(`fiscal_collection`.`fdate`) >= parseDateTimeBestEffort(?) AND toDateOrNull(`fiscal_collection`.`fdate`) <= parseDateTimeBestEffort(?))\nGROUP BY 1\nORDER BY  3  DESC\nLIMIT 1002022-01-01T00:00:00.000Z2022-12-31T23:59:59.999Z",
  "sql_count": 1,
  "answer": "口径声明：主题 fiscal_collection_view（缴款全景）；分组维度 rec_bank_code（收款银行编码）——ai_context 明确 *_name 为多别名字典序拼接列，禁止用于分组，故按编码列示；笔数用 paybook_count（缴款书笔数，count 为项目行明细数会重复计数）；金额用 amt（缴款金额，非入账金额 entered_amt）；时间轴 pay_date（缴款日期）2022-01-01~2022-12-31。共 6 家收款银行有数据，未截断；金额最高为 0105（211 笔、182.08 亿元）。未做跨行合计（无占比语义不造分母）。",
  "errors": [],
  "elapsed_s": 17.3,
  "arbiter": null,
  "raw_path": "rounds/m0/runs/cube/q19.raw.json"
}