{
  "id": "q05",
  "question": "一笔缴款从缴款人缴款开始，到资金最终缴入国库，中间要依次经过哪些环节？",
  "status": "answer",
  "metrics_hit": [],
  "sql": "",
  "sql_count": 0,
  "answer": "这个问题与上一轮相同，结论已在本轮会话中完成“业务文档 + 库内实测”双重核验（数字为 2026-10-23 实测），直接给出答案：\n\n## 资金链全流程（缴款人 → 国库）\n\n```text\n执收单位开缴款通知书（业务起点，征收项目明细在明细表）\n        │  两条缴款路径：直缴（缴款人→代理银行） / 汇缴（单位定期汇总上缴）\n        ▼\n① 缴款        fne_paybook_full_high        银行代收，钱进入过渡/汇缴账户\n        ▼\n② 清分        fne_funddivide_new           按分成比例确定中央/省/市/县归属\n        ▼\n③ 汇总        fne_funddivide_transfer      明细归入\"清分汇总批次\"(fcollectid)\n        ▼\n④ 划拨        fne_funddivide_transfer + fne_transfer_new   生成划拨指令、银行划转\n        ▼\n⑤ 缴库        fne_treasury_transfer_new    资金缴入国库（流水另有 fne_income_daybook）\n        ▼\n⑥ 对账/财政记账    —— 本库无落地表（数据空缺，仅散落 freconcilestatus 字段）\n```\n\n## 各环节落地表与连接键\n\n| 环节 | 落地表（实测行数） | 与上一环节连接键 |\n|---|---|---|\n| ① 缴款 | `fne_paybook_full_high`（1,281 行 / 去重 1,110 笔） | 业务起点；直缴/汇缴看 `fbustype`（1/2） |\n| ② 清分 | `fne_funddivide_new`（728 行） | `fpaybooksubid = paybook_full_high.fid`（R1 边，实测 1,130 行） |\n| ③ 汇总 | 与④共表 `fne_funddivide_transfer`（728 行） | 同上；空 `fcollectid` = 尚未入批次 |\n| ④ 划拨 | `fne_funddivide_transfer`（ftransno/ftransamt/fistransfer）+ `fne_transfer_new`（129 行 / 93 条流水） | `fcollectid = transfer_new.fcollectid`（R2 边，实测 160 行） |\n| ⑤ 缴库 | `fne_treasury_transfer_new`（505 行 / 按 fid 去重 76 笔） | `ftranscollectid = fdt.fcollectid`（R3）/ `fpid = fdt.fid`（R4） |\n| ⑥ 对账/记账 | ❌ 无表 | 问数命中时需明确告知数据空缺 |\n\n**两条旁路**：单位汇缴缴库支线 `fne_agen_treasury_new`（16 行，暂无打通键）；反向资金流退付 `fne_backpay`（独立成链）。\n\n## 三个必守口径\n\n1. **键语义**：`_high` 宽表 `fid`=明细行、`fpid`=主单；`_new` 主表 `fid` 是主单——跨表连 `fid` 会静默 0 行。\n2. **去重强制**：缴款/缴库表都有生命周期多版本（缴库 505 行含 462 行报文重发），笔数 `uniqExact(fid)`、缴库金额按 fid 去重后 SUM（直 SUM 虚增到 12.94 亿，真实 76 笔 / 2,953.5 万元）。\n3. **直缴/汇缴分口径**：fne_ 直缴链与 une_ 汇缴体系严禁 UNION 求总收入；提“直缴”必须按 `fbustype='1'` 收窄。\n\n**一句话**：缴款 → 清分 → 汇总 → 划拨 → 缴库（→ 对账/记账无数据），表链 `fne_paybook_full_high → fne_funddivide_new → fne_funddivide_transfer → fne_transfer_new → fne_treasury_transfer_new`，串联键 `fpaybooksubid → fcollectid → ftranscollectid`。",
  "errors": [],
  "elapsed_s": 11.8,
  "arbiter": null,
  "raw_path": "rounds/round-02/runs/datus/q05.payload.jsonl"
}