{
  "id": "q25",
  "question": "有没有票据已经作废、但对应缴款仍被计入收入的情况？",
  "status": "answer",
  "metrics_hit": [
    {
      "measures": [
        "fiscal_collection_view.count",
        "fiscal_collection_view.paybook_count",
        "fiscal_collection_view.amt",
        "fiscal_collection_view.entered_amt"
      ],
      "dimensions": [
        "fiscal_collection_view.state"
      ]
    },
    {
      "measures": [
        "fiscal_collection_view.count",
        "fiscal_collection_view.amt",
        "fiscal_collection_view.entered_amt"
      ],
      "dimensions": [
        "fiscal_collection_view.pay_code",
        "fiscal_collection_view.pay_date",
        "fiscal_collection_view.item_code"
      ]
    }
  ],
  "sql": "SELECT `fiscal_collection`.`fstate` `fiscal_collection_view__state`, count(*) `fiscal_collection_view__count`, COUNT(DISTINCT `fiscal_collection`.`fpaycode`) `fiscal_collection_view__paybook_count`, sum(`fiscal_collection`.`famt`) `fiscal_collection_view__amt`, sum(CASE WHEN (`fiscal_collection`.`freceiveddate` != '') THEN `fiscal_collection`.`fimamt` END) `fiscal_collection_view__entered_amt` \nFROM  (SELECT * FROM (\n  SELECT * FROM (\n    SELECT * FROM (\n      SELECT * FROM (\n        SELECT t.*, c.chg_agency_name_canon FROM fne_paybook_full_high t\n        LEFT JOIN (SELECT fchgagencode,\n                          arrayStringConcat(arraySort(groupUniqArray(fchgagenname)), ' / ') AS chg_agency_name_canon\n                   FROM fne_paybook_full_high GROUP BY fchgagencode) c ON t.fchgagencode = c.fchgagencode\n      ) x1\n      LEFT JOIN (SELECT frecrgncode,\n                        arrayStringConcat(arraySort(groupUniqArray(frecrgnname)), ' / ') AS rec_rgn_name_canon\n                 FROM fne_paybook_full_high WHERE frecrgncode != '' GROUP BY frecrgncode) r ON x1.frecrgncode = r.frecrgncode\n    ) x2\n    LEFT JOIN (SELECT fitemcode,\n                      arrayStringConcat(arraySort(groupUniqArray(fitemname)), ' / ') AS item_name_canon\n               FROM fne_paybook_full_high WHERE fitemcode != '' GROUP BY fitemcode) i ON x2.fitemcode = i.fitemcode\n  ) x3\n  LEFT JOIN (SELECT fsubcode,\n                    arrayStringConcat(arraySort(groupUniqArray(fsubname)), ' / ') AS sub_name_canon\n             FROM fne_paybook_full_high WHERE fsubcode != '' GROUP BY fsubcode) s ON x3.fsubcode = s.fsubcode\n) x4\nLEFT JOIN (SELECT frecsubcode,\n                  arrayStringConcat(arraySort(groupUniqArray(frecsubname)), ' / ') AS rec_sub_name_canon\n           FROM fne_paybook_full_high WHERE frecsubcode != '' GROUP BY frecsubcode) rs ON x4.frecsubcode = rs.frecsubcode\n)  AS `fiscal_collection`\nWHERE (`fiscal_collection`.`fstate` = ?)\nGROUP BY 1\nORDER BY  4  DESC\nLIMIT 1002",
  "sql_count": 2,
  "answer": "口径声明：以 fiscal_collection_view（缴款全景，缴款书×项目行粒度）为准，\"票据作废\"绑定缴款书状态 state=2（fstate）；\"计入收入\"以两个金额度量审视——amt（缴款明细金额）与 entered_amt（到账金额，freceiveddate 非空的 fimamt 合计）。全量无时间过滤查询结果：作废票据共 1 笔明细 / 1 张缴款书，缴款金额 1 元，到账金额为 null（资金从未到账）。即该作废票在 amt 口径下留有 1 元缴款记录，但按到账口径（entered_amt）未计入任何实际到账收入，不构成\"作废票对应缴款被计入收入\"的金额偏差。数据范围：全量数据（未加时间过滤，覆盖 pay_date 全部历史），无截断。歧义拍板：\"计入收入\"无固化成员/词典约定，按 ai_context 双金额口径（缴款 amt / 到账 entered_amt）并列呈现，未静默选单一口径。",
  "errors": [],
  "elapsed_s": 26.1,
  "arbiter": null,
  "raw_path": "rounds/round-02/runs/cube/q25.raw.json"
}