{
  "id": "q01",
  "question": "非税收入收缴业务的起点和终点分别是什么？",
  "status": "answer",
  "metrics_hit": [],
  "sql": "",
  "sql_count": 0,
  "answer": "这个问题我已在上一轮基于业务文档《01-非税业务说明》核实过，直接给出结论：\n\n## 答案\n\n- **起点：执收单位发起缴款通知书**\n  执收单位依法征收非税收入，开出缴款通知书作为缴款依据（缴款人票面信息在主表，征收项目与金额在明细表，对应 `FNE_PAYBOOK` + `FNE_PAYBOOK_ITEM`）。\n\n- **终点：资金缴入国库（缴库）**\n  资金经清分 → 汇总 → 划拨后缴入国库（对应 `FNE_TREASURY_TRANSFER`，国库角色在业务文档中明确标注为“终点”）。\n\n## 全链路一览\n\n```text\n执收单位发起缴款通知书 ← 起点\n   ↓ 缴款（直缴 fbustype='1' / 汇缴 fbustype='2'）\n银行代收\n   ↓\n① 清分 → ② 汇总 → ③ 划拨 → ④ 缴库 ← 终点\n```\n\n补充两点：\n1. 流程最末端还有**对账与财政记账**环节，但当前库中**无落地表（数据空缺）**，因此数据可分析的终点就是**缴库**。\n2. 票据流（财政电子票据）与资金流并行，随缴款开具，不是资金链的起点或终点。\n\n如需我用缴款、缴库等表实际验证资金链各环节的数据衔接（如按 FPID/FTRANSNO 追踪），随时可以继续。",
  "errors": [],
  "elapsed_s": 13.9,
  "arbiter": null,
  "raw_path": "rounds/round-02/runs/datus/q01.payload.jsonl"
}