{
  "id": "q24",
  "question": "统计一笔缴款的金额，应该以缴款通知书票面上的总金额为准，还是按征收项目的金额明细来算？",
  "status": "answer",
  "metrics_hit": [],
  "sql": "SELECT fpid, fid, famt, ftotalamt, fimamt, fretireamt, fnumber, fstd,\n       fitemname, fsubname, fstate, fdatatag, fbustype,\n       fenterdate, fenterdate_last, ffilldate, fisenter, fisenter_last,\n       fistransfer, fistransfer_last\nFROM fne_paybook_full_high\nWHERE fpid = 'd1eb61c8925b4faba47c43a3714a820f'\nORDER BY fenterdate, fid",
  "sql_count": 6,
  "answer": "## 结论：以**征收项目金额明细**为准，不能直接用票面总金额\n\n两种口径在语义上不是“谁对谁错”的关系，而是**明细是源、总额是冗余**。业务文档（`01-非税业务说明.md`）也明确写了：\"缴款书票面头信息在主表（缴款人、总金额），征收项目与金额在明细表；**金额统计走明细**\"。\n\n### 为什么不能用票面总金额（ftotalamt）\n\n`fne_paybook_full_high` 是**明细行粒度**的宽表——一张缴款通知书（`fpid`）可以有多条征收项目明细（`fid`），而票面总额 `ftotalamt` 会**在每一条明细行上冗余重复**。直接 `SUM(ftotalamt)` 是典型的 fan trap（扇出陷阱）：一张票 3 个项目就会把总额算 3 遍。\n\n### 为什么明细金额也不是直接 SUM——本次实测的新发现\n\n`famt`（明细金额）虽然语义正确，但**原始 SUM 也有虚增风险**，今天实测（全表 975 张票）验证了三个数字：\n\n| 口径 | 票据数 | 金额（元） |\n|---|---|---|\n| 明细金额去重合计（正确口径） | 975 | **18,331,322,225.08** |\n| 票面总额（每票取一次） | 975 | 18,331,320,225.08 |\n| 明细金额直接 SUM（错误） | — | 18,332,267,287.91 |\n\n- **原始 `SUM(famt)` 虚增约 94.7 万元，波及 141 张票**：原因是 `fid` 存在生命周期多版本重复（同一明细行被 ETL 多次入库），必须先按 `(fpid, fid)` 去重（建议 `argMax(famt, fenterdate)` 取最新版本），去重后 140 张票自然对平。\n- **去重后仍有 1 张票差 2,000 元**（`fpid=d1eb61c8…`）：这张票有 4 行明细，其中两个 `fid` 仅末 6 位不同（`fd6f74eb91775769…` vs `fd6f74eb91785769…`），分属\"农网还贷/考试考务费\"两个项目、各 1,000 元，合计 4,000 > 票面 2,000。**这恰好是支持明细口径的证据**：`fimamt`（已清分金额）合计正好 = 2,000 = 票面总额，说明多出的一对 1,000 元是重复/冲正脏行；此时票面总额可以做**对账锚点**，但不能作为计算口径。\n\n### 标准写法（ClickHouse）\n\n```sql\nWITH per_item AS (\n  SELECT\n    fpid,\n    fid,\n    argMax(famt, fenterdate) AS famt_latest\n  FROM fne_paybook_full_high\n  GROUP BY fpid, fid\n)\nSELECT\n  uniqExact(fpid)              AS 笔数,   -- 一票多项目行\n  round(sum(famt_latest), 2)   AS 缴款金额 -- 明细口径、按 (fpid,fid) 去重\nFROM per_item\n```\n\n一句话总结：**计算用明细（`famt`，先按 `(fpid,fid)` 去重），对账才看票面（`ftotalamt`，每票取一次）**；两者长期对不平的票据要单独排查脏数据，而不是简单选一边。该口径已沉淀到项目记忆，与既有\"ftotalamt 是主单冗余列禁直 SUM\"的 fan-trap 规则一致。",
  "errors": [],
  "elapsed_s": 327.6,
  "arbiter": null,
  "raw_path": "rounds/round-02/runs/datus/q24.payload.jsonl"
}