{
  "id": "q01",
  "question": "非税收入收缴业务的起点和终点分别是什么？",
  "status": "answer",
  "metrics_hit": [],
  "sql": "",
  "sql_count": 0,
  "answer": "本问题为业务流程语义问题，依据 /agent/meta 三个视图的 ai_context 作答（无数据聚合、无结果表）。起点：执收单位开具缴款书（fill_date，票面填开日期；缴款书 state=1 待缴款为业务起点状态），缴款人完成缴款（pay_date 缴款日期）。中间环节：资金到账（received_date）、按 calc_source 分成/提留清分、确定收入归属（rec_* 侧）。终点：资金按 bgt_style 归集——进国库或财政专户；终点以缴库入库为准（fiscal_treasury_view，缴库单→缴库回执 status='9'→已入国库 enter_status），清分划拨过程见 fiscal_allocation_view（enter_date 划拨到账）。即：起点=开具缴款书/待缴款，终点=缴库入国库（专户管理资金则以划入专户为终点）。",
  "errors": [],
  "elapsed_s": 7.7,
  "arbiter": null,
  "raw_path": "rounds/round-02/runs/cube/q01.raw.json"
}