{
  "id": "q26",
  "question": "有没有缴款还没完成、财政电子票据却已经先开具出来的情况？",
  "status": "answer",
  "metrics_hit": [
    {
      "measures": [
        "fiscal_collection_view.paybook_count",
        "fiscal_collection_view.count",
        "fiscal_collection_view.amt"
      ],
      "dimensions": [
        "fiscal_collection_view.state"
      ]
    },
    {
      "measures": [
        "fiscal_collection_view.paybook_count",
        "fiscal_collection_view.count",
        "fiscal_collection_view.amt"
      ],
      "dimensions": []
    }
  ],
  "sql": "SELECT `fiscal_collection`.`fstate` `fiscal_collection_view__state`, COUNT(DISTINCT `fiscal_collection`.`fpaycode`) `fiscal_collection_view__paybook_count`, count(*) `fiscal_collection_view__count`, sum(`fiscal_collection`.`famt`) `fiscal_collection_view__amt` \nFROM  (SELECT * FROM (\n  SELECT * FROM (\n    SELECT * FROM (\n      SELECT * FROM (\n        SELECT t.*, c.chg_agency_name_canon FROM fne_paybook_full_high t\n        LEFT JOIN (SELECT fchgagencode,\n                          arrayStringConcat(arraySort(groupUniqArray(fchgagenname)), ' / ') AS chg_agency_name_canon\n                   FROM fne_paybook_full_high GROUP BY fchgagencode) c ON t.fchgagencode = c.fchgagencode\n      ) x1\n      LEFT JOIN (SELECT frecrgncode,\n                        arrayStringConcat(arraySort(groupUniqArray(frecrgnname)), ' / ') AS rec_rgn_name_canon\n                 FROM fne_paybook_full_high WHERE frecrgncode != '' GROUP BY frecrgncode) r ON x1.frecrgncode = r.frecrgncode\n    ) x2\n    LEFT JOIN (SELECT fitemcode,\n                      arrayStringConcat(arraySort(groupUniqArray(fitemname)), ' / ') AS item_name_canon\n               FROM fne_paybook_full_high WHERE fitemcode != '' GROUP BY fitemcode) i ON x2.fitemcode = i.fitemcode\n  ) x3\n  LEFT JOIN (SELECT fsubcode,\n                    arrayStringConcat(arraySort(groupUniqArray(fsubname)), ' / ') AS sub_name_canon\n             FROM fne_paybook_full_high WHERE fsubcode != '' GROUP BY fsubcode) s ON x3.fsubcode = s.fsubcode\n) x4\nLEFT JOIN (SELECT frecsubcode,\n                  arrayStringConcat(arraySort(groupUniqArray(frecsubname)), ' / ') AS rec_sub_name_canon\n           FROM fne_paybook_full_high WHERE frecsubcode != '' GROUP BY frecsubcode) rs ON x4.frecsubcode = rs.frecsubcode\n)  AS `fiscal_collection`\nGROUP BY 1\nORDER BY  3  DESC\nLIMIT 100",
  "sql_count": 2,
  "answer": "口径声明：按 meta ai_context，缴款书状态 fstate 中 1=正常(待缴款)、2=作废、3=已缴款确认；业务链路为开票(fill_date)→缴款(pay_date)→缴款确认(confirm_date)，因此 state='1' 即『票据已先开具、缴款尚未完成』的情形（欠缴判定口径）。结论：存在该情况——1 张缴款书（1 条项目明细行）处于待缴款状态，票面金额 120.8 元，缴款至今未完成确认。其余 965 张缴款书（1266 条明细行，183.31 亿元）已缴款确认，另有 8 张（13 行，115.66 万元）状态字段为空、1 张已作废。数据范围：fiscal_collection_view（缴款全景）全量数据，无时间过滤；查询未截断。",
  "errors": [],
  "elapsed_s": 36.1,
  "arbiter": null,
  "raw_path": "rounds/round-02/runs/cube/q26.raw.json"
}