{
  "id": "q06",
  "question": "执收单位和预算单位是一回事吗？两者的区别和联系是什么？",
  "status": "answer",
  "metrics_hit": [
    {
      "measures": [
        "fiscal_collection_view.count"
      ],
      "dimensions": [
        "fiscal_collection_view.chg_agency_code"
      ]
    },
    {
      "measures": [
        "fiscal_collection_view.count"
      ],
      "dimensions": [
        "fiscal_collection_view.rec_bgt_agen_code"
      ]
    }
  ],
  "sql": "SELECT `fiscal_collection`.`fchgagencode` `fiscal_collection_view__chg_agency_code`, count(*) `fiscal_collection_view__count` \nFROM  (SELECT * FROM (\n  SELECT * FROM (\n    SELECT * FROM (\n      SELECT * FROM (\n        SELECT t.*, c.chg_agency_name_canon FROM fne_paybook_full_high t\n        LEFT JOIN (SELECT fchgagencode,\n                          arrayStringConcat(arraySort(groupUniqArray(fchgagenname)), ' / ') AS chg_agency_name_canon\n                   FROM fne_paybook_full_high GROUP BY fchgagencode) c ON t.fchgagencode = c.fchgagencode\n      ) x1\n      LEFT JOIN (SELECT frecrgncode,\n                        arrayStringConcat(arraySort(groupUniqArray(frecrgnname)), ' / ') AS rec_rgn_name_canon\n                 FROM fne_paybook_full_high WHERE frecrgncode != '' GROUP BY frecrgncode) r ON x1.frecrgncode = r.frecrgncode\n    ) x2\n    LEFT JOIN (SELECT fitemcode,\n                      arrayStringConcat(arraySort(groupUniqArray(fitemname)), ' / ') AS item_name_canon\n               FROM fne_paybook_full_high WHERE fitemcode != '' GROUP BY fitemcode) i ON x2.fitemcode = i.fitemcode\n  ) x3\n  LEFT JOIN (SELECT fsubcode,\n                    arrayStringConcat(arraySort(groupUniqArray(fsubname)), ' / ') AS sub_name_canon\n             FROM fne_paybook_full_high WHERE fsubcode != '' GROUP BY fsubcode) s ON x3.fsubcode = s.fsubcode\n) x4\nLEFT JOIN (SELECT frecsubcode,\n                  arrayStringConcat(arraySort(groupUniqArray(frecsubname)), ' / ') AS rec_sub_name_canon\n           FROM fne_paybook_full_high WHERE frecsubcode != '' GROUP BY frecsubcode) rs ON x4.frecsubcode = rs.frecsubcode\n)  AS `fiscal_collection`\nGROUP BY 1\nORDER BY  2  DESC\nLIMIT 100",
  "sql_count": 2,
  "answer": "结论：不是一回事。①执收单位：指缴款书上的执收方（收缴执行侧主体），模型有完整建模（fiscal_collection_view.chg_agency_code/chg_agency_name + chg_rgn_*），实测 36 个非空单位编码、缴款行数分布见表1；口径词典'执收单位'词条同样映射执收侧 chg_agen。②预算单位：当前模型没有名为'预算单位'的成员；语义上最接近的是'收入方预算归类'（rec_bgt_agen_code/rec_bgt_agen_name，资金收入归属的预算侧归类字段），实测 1281 行该列全部为空（表2），即本库按'预算单位'查不出任何数据。③区别与联系：两者同属缴款全景事实（fne_paybook_full_high）的单位类维度，但侧别不同——执收单位在收缴侧（谁执收），预算归类在收入归属侧（资金归入哪类预算主体），一个有数、一个源列全空，不能互相替代；按单位汇总请用执收单位编码分组（分组必须用 *_code，*_name 是别名拼接仅展示）。数据范围：缴款全景视图全量 1281 行，无时间过滤。",
  "errors": [],
  "elapsed_s": 41.2,
  "arbiter": null,
  "raw_path": "rounds/round-02/runs/cube/q06.raw.json"
}