{
  "id": "q29",
  "question": "汇缴缴款的缴款明细记录有哪些？",
  "status": "answer",
  "metrics_hit": [
    {
      "measures": [
        "fiscal_collection_view.amt"
      ],
      "dimensions": [
        "fiscal_collection_view.pay_code",
        "fiscal_collection_view.pay_date",
        "fiscal_collection_view.chg_agency_code",
        "fiscal_collection_view.chg_agency_name",
        "fiscal_collection_view.sub_code",
        "fiscal_collection_view.sub_name"
      ]
    },
    {
      "measures": [
        "fiscal_collection_view.amt",
        "fiscal_collection_view.count",
        "fiscal_collection_view.paybook_count"
      ],
      "dimensions": []
    }
  ],
  "sql": "SELECT `fiscal_collection`.`fpaycode` `fiscal_collection_view__pay_code`, toTimeZone(toDateTime64(toDateOrNull(`fiscal_collection`.`fdate`), 0), 'UTC') `fiscal_collection_view__pay_date`, `fiscal_collection`.`fchgagencode` `fiscal_collection_view__chg_agency_code`, `fiscal_collection`.chg_agency_name_canon `fiscal_collection_view__chg_agency_name`, `fiscal_collection`.`fsubcode` `fiscal_collection_view__sub_code`, `fiscal_collection`.sub_name_canon `fiscal_collection_view__sub_name`, sum(`fiscal_collection`.`famt`) `fiscal_collection_view__amt` \nFROM  (SELECT * FROM (\n  SELECT * FROM (\n    SELECT * FROM (\n      SELECT * FROM (\n        SELECT t.*, c.chg_agency_name_canon FROM fne_paybook_full_high t\n        LEFT JOIN (SELECT fchgagencode,\n                          arrayStringConcat(arraySort(groupUniqArray(fchgagenname)), ' / ') AS chg_agency_name_canon\n                   FROM fne_paybook_full_high GROUP BY fchgagencode) c ON t.fchgagencode = c.fchgagencode\n      ) x1\n      LEFT JOIN (SELECT frecrgncode,\n                        arrayStringConcat(arraySort(groupUniqArray(frecrgnname)), ' / ') AS rec_rgn_name_canon\n                 FROM fne_paybook_full_high WHERE frecrgncode != '' GROUP BY frecrgncode) r ON x1.frecrgncode = r.frecrgncode\n    ) x2\n    LEFT JOIN (SELECT fitemcode,\n                      arrayStringConcat(arraySort(groupUniqArray(fitemname)), ' / ') AS item_name_canon\n               FROM fne_paybook_full_high WHERE fitemcode != '' GROUP BY fitemcode) i ON x2.fitemcode = i.fitemcode\n  ) x3\n  LEFT JOIN (SELECT fsubcode,\n                    arrayStringConcat(arraySort(groupUniqArray(fsubname)), ' / ') AS sub_name_canon\n             FROM fne_paybook_full_high WHERE fsubcode != '' GROUP BY fsubcode) s ON x3.fsubcode = s.fsubcode\n) x4\nLEFT JOIN (SELECT frecsubcode,\n                  arrayStringConcat(arraySort(groupUniqArray(frecsubname)), ' / ') AS rec_sub_name_canon\n           FROM fne_paybook_full_high WHERE frecsubcode != '' GROUP BY frecsubcode) rs ON x4.frecsubcode = rs.frecsubcode\n)  AS `fiscal_collection`\nWHERE (`fiscal_collection`.`fbustype` = ?)\nGROUP BY 1, 2, 3, 4, 5, 6\nORDER BY  2  DESC\nLIMIT 1002",
  "sql_count": 2,
  "answer": "口径：汇缴=缴款书业务类型 bus_type=2（口径词典 2026-10-21 拍板，legacy:false），取自 fiscal_collection_view 缴款书×项目行明细粒度。全量汇缴共 216 行明细、125 笔缴款书、金额合计 2,284,852,272.66 元；明细表受 limit=100 截断，仅展示最近 100 行（按缴款日期倒序），全量见构建器查询。",
  "errors": [],
  "elapsed_s": 72.0,
  "arbiter": null,
  "raw_path": "rounds/m0/runs/cube/q29.raw.json"
}