{
  "id": "q02",
  "question": "财政部门在代理银行开设的账户有哪几种？各自用来做什么？",
  "status": "answer",
  "metrics_hit": [
    {
      "measures": [
        "fiscal_collection_view.count",
        "fiscal_collection_view.paybook_count",
        "fiscal_collection_view.amt"
      ],
      "dimensions": [
        "fiscal_collection_view.rec_acct_type"
      ]
    },
    {
      "measures": [
        "fiscal_collection_view.count",
        "fiscal_collection_view.amt"
      ],
      "dimensions": [
        "fiscal_collection_view.rec_acct_type",
        "fiscal_collection_view.income_sort_name"
      ]
    }
  ],
  "sql": "SELECT `fiscal_collection`.`frecaccttype` `fiscal_collection_view__rec_acct_type`, count(*) `fiscal_collection_view__count`, COUNT(DISTINCT `fiscal_collection`.`fpaycode`) `fiscal_collection_view__paybook_count`, sum(`fiscal_collection`.`famt`) `fiscal_collection_view__amt` \nFROM  (SELECT * FROM (\n  SELECT * FROM (\n    SELECT * FROM (\n      SELECT * FROM (\n        SELECT t.*, c.chg_agency_name_canon FROM fne_paybook_full_high t\n        LEFT JOIN (SELECT fchgagencode,\n                          arrayStringConcat(arraySort(groupUniqArray(fchgagenname)), ' / ') AS chg_agency_name_canon\n                   FROM fne_paybook_full_high GROUP BY fchgagencode) c ON t.fchgagencode = c.fchgagencode\n      ) x1\n      LEFT JOIN (SELECT frecrgncode,\n                        arrayStringConcat(arraySort(groupUniqArray(frecrgnname)), ' / ') AS rec_rgn_name_canon\n                 FROM fne_paybook_full_high WHERE frecrgncode != '' GROUP BY frecrgncode) r ON x1.frecrgncode = r.frecrgncode\n    ) x2\n    LEFT JOIN (SELECT fitemcode,\n                      arrayStringConcat(arraySort(groupUniqArray(fitemname)), ' / ') AS item_name_canon\n               FROM fne_paybook_full_high WHERE fitemcode != '' GROUP BY fitemcode) i ON x2.fitemcode = i.fitemcode\n  ) x3\n  LEFT JOIN (SELECT fsubcode,\n                    arrayStringConcat(arraySort(groupUniqArray(fsubname)), ' / ') AS sub_name_canon\n             FROM fne_paybook_full_high WHERE fsubcode != '' GROUP BY fsubcode) s ON x3.fsubcode = s.fsubcode\n) x4\nLEFT JOIN (SELECT frecsubcode,\n                  arrayStringConcat(arraySort(groupUniqArray(frecsubname)), ' / ') AS rec_sub_name_canon\n           FROM fne_paybook_full_high WHERE frecsubcode != '' GROUP BY frecsubcode) rs ON x4.frecsubcode = rs.frecsubcode\n)  AS `fiscal_collection`\nGROUP BY 1\nORDER BY  4  DESC\nLIMIT 100",
  "sql_count": 2,
  "answer": "口径声明：'账户种类'按 fiscal_collection_view 收款账户类型（frecaccttype 字典 136）识别，全字典为 0虚拟/1财政专户/2汇缴专户/3待解缴/4单位监管/5国库/7单位清分/9其他 共 8 类；实际数据中仅出现 3 类——1 财政专户（非税收入收缴专户，承接政府性基金/专项/行政事业性收费等各项非税收入，为绝对主体）、5 国库（人民银行国库账户口径，少量政府性基金/收费/罚没）、3 待解缴（暂存待划转）。'各自用来做什么'按账户类型×收入分类的承接分布呈现（表B）。无时间过滤（全量数据范围）；字典中 0/2/4/7/9 类在当前数据无任何行。账户名称维度下存在'测试云南省财政厅'等测试脏数据（一码多名仅跟随展示），金额以编码口径为准。歧义拍板：无 ai_context 多口径分叉，词典'代理银行账户'无词条，直接采用成员字典口径。",
  "errors": [],
  "elapsed_s": 40.0,
  "arbiter": null,
  "raw_path": "rounds/round-02/runs/cube/q02.raw.json"
}