{
  "id": "q26",
  "question": "划拨金额按划入的下级区划和划入单位拆分统计",
  "status": "answer",
  "metrics_hit": [
    {
      "measures": [
        "fiscal_allocation_view.trans_amt",
        "fiscal_allocation_view.count"
      ],
      "dimensions": [
        "fiscal_allocation_view.rec_rgn_code",
        "fiscal_allocation_view.rec_agency_code"
      ]
    }
  ],
  "sql": "SELECT `fiscal_allocation`.`frecrgncode` `fiscal_allocation_view__rec_rgn_code`, `fiscal_allocation`.`frecagenidcode` `fiscal_allocation_view__rec_agency_code`, sum(`fiscal_allocation`.`ftransamt`) `fiscal_allocation_view__trans_amt`, count(*) `fiscal_allocation_view__count` \nFROM  (SELECT * FROM (\n  SELECT * FROM (\n    SELECT * FROM (\n      SELECT t.*, c.chg_agency_name_canon FROM fne_funddivide_transfer t\n      LEFT JOIN (SELECT fchgagencode,\n                        arrayStringConcat(arraySort(groupUniqArray(fchgagenname)), ' / ') AS chg_agency_name_canon\n                 FROM fne_funddivide_transfer GROUP BY fchgagencode) c ON t.fchgagencode = c.fchgagencode\n    ) x1\n    LEFT JOIN (SELECT frecrgncode,\n                      arrayStringConcat(arraySort(groupUniqArray(frecrgnname)), ' / ') AS rec_rgn_name_canon\n               FROM fne_funddivide_transfer WHERE frecrgncode != '' GROUP BY frecrgncode) r ON x1.frecrgncode = r.frecrgncode\n  ) x2\n  LEFT JOIN (SELECT fitemcode,\n                    arrayStringConcat(arraySort(groupUniqArray(fitemname)), ' / ') AS item_name_canon\n             FROM fne_funddivide_transfer WHERE fitemcode != '' GROUP BY fitemcode) i ON x2.fitemcode = i.fitemcode\n) x3\nLEFT JOIN (SELECT frecsubcode,\n                  arrayStringConcat(arraySort(groupUniqArray(frecsubname)), ' / ') AS rec_sub_name_canon\n           FROM fne_funddivide_transfer WHERE frecsubcode != '' GROUP BY frecsubcode) rs ON x3.frecsubcode = rs.frecsubcode\n)  AS `fiscal_allocation`\nGROUP BY 1, 2\nORDER BY  3  DESC\nLIMIT 100",
  "sql_count": 1,
  "answer": "口径：金额用划拨金额 trans_amt（ftransamt 合计，划拨口径，非分入金额 im_amt）；分组维度为划入方区划编码 rec_rgn_code × 划入方单位编码 rec_agency_code（meta ai_context：划入方看 rec_rgn/rec_agency 成对字段，分组必须用 *_code，*_name 为别名拼接不作准）。歧义拍板：①「划入的下级区划」按划入方区划编码出——层级 ETL（上/下级分入判定）未落地，无法按上下级层级过滤，如需限定某一级需另行指定区划编码过滤；②划入单位无名称数据列（meta 标注「名称列缺口，待 ETL」），只出编码。数据范围：全库无时间过滤（时间过滤轴为 pay_date），共 29 个区划×单位组合、728 笔清分，划拨金额合计 72507.62 元；金额集中在 530000（省本级）区划，最大一笔组合 63371 元/291 笔；另有 21 组 trans_amt 为 null（未发划拨或无划拨金额，仅 count 有值）。未按方向过滤 is_transfer/income_type，若只要「已划转」或「跨区划」口径需追加 filter。",
  "errors": [],
  "elapsed_s": 25.7,
  "arbiter": null,
  "raw_path": "rounds/m0/runs/cube/q26.raw.json"
}