{
  "id": "q03",
  "question": "清分金额 2022 年对比 2021 年同比增长多少？",
  "status": "answer",
  "metrics_hit": [
    {
      "measures": [
        "fiscal_allocation_view.im_amt",
        "fiscal_allocation_view.im_amt_yoy_diff",
        "fiscal_allocation_view.im_amt_yoy_rate"
      ],
      "dimensions": []
    }
  ],
  "sql": "",
  "sql_count": 0,
  "answer": "口径声明：按您拍板采用分入金额 im_amt（清分收入口径），时间轴 pay_date，2022 年全年（2022-01-01~2022-12-31）按年粒度同比，同比由引擎 _yoy 系成员计算。数据范围：该查询返回 0 行——2022 年时间范围内（pay_date 轴）无清分数据，2022 年分入金额为 0，同比增长率因上年同期基数无法成立（返回无数据），报「无法计算/该期无数据」。如需确认数据覆盖期或改用其他金额口径，请明示后另查。",
  "errors": [],
  "elapsed_s": 40.9,
  "arbiter": {
    "mode": "auto",
    "policy": "option-1",
    "first_type": "ask",
    "ask_question": "「清分金额」在本主题（fiscal_allocation_view 清分流向）存在两个金额口径，ai_context 未约定默认项，词典也无「清分金额」词条，需拍板：分入金额（im_amt，清分收入口径）还是划拨金额（trans_amt，划拨口径）？",
    "options": [
      "分入金额 im_amt（清分收入口径）",
      "划拨金额 trans_amt（划拨口径）",
      "两个口径各出一版对比"
    ],
    "followups": [
      {
        "question": "就按第一个选项的口径来（分入金额 im_amt（清分收入口径）），直接出答案。",
        "response_type": "answer",
        "response": {
          "type": "answer",
          "title": "2022年清分（分入金额口径）同比增长：查询范围内无数据",
          "plan": [
            [
              "清分金额按用户拍板取分入金额 im_amt（清分收入口径）",
              "fiscal_allocation_view.im_amt",
              "用户拍板：选分入口径；词典无该词条"
            ],
            [
              "2022年同比用引擎固化同比成员，按 pay_date 年粒度",
              "fiscal_allocation_view.im_amt_yoy_diff / im_amt_yoy_rate",
              "ai_context：_yoy 系直接绑定，答案层勿重复计算"
            ],
            [
              "查询返回 0 行，按空集直接拍板出答案",
              "fiscal_allocation_view.pay_date 2022-01-01~2022-12-31",
              "契约：空结果直接拍板，禁止反向探测查询"
            ]
          ],
          "tables": [
            {
              "title": "分入金额 2022 年同比（口径：im_amt 分入金额，pay_date 轴，查询范围内无数据）",
              "query": {
                "measures": [
                  "fiscal_allocation_view.im_amt",
                  "fiscal_allocation_view.im_amt_yoy_diff",
                  "fiscal_allocation_view.im_amt_yoy_rate"
                ],
                "timeDimensions": [
                  {
                    "dimension": "fiscal_allocation_view.pay_date",
                    "dateRange": [
                      "2022-01-01",
                      "2022-12-31"
                    ],
                    "granularity": "year"
                  }
                ],
                "order": {
                  "fiscal_allocation_view.im_amt": "desc"
                },
                "limit": 100
              },
              "rows": [],
              "total": null
            }
          ],
          "answer": "口径声明：按您拍板采用分入金额 im_amt（清分收入口径），时间轴 pay_date，2022 年全年（2022-01-01~2022-12-31）按年粒度同比，同比由引擎 _yoy 系成员计算。数据范围：该查询返回 0 行——2022 年时间范围内（pay_date 轴）无清分数据，2022 年分入金额为 0，同比增长率因上年同期基数无法成立（返回无数据），报「无法计算/该期无数据」。如需确认数据覆盖期或改用其他金额口径，请明示后另查。",
          "assumption": "清分金额 → fiscal_allocation_view.im_amt（分入金额，清分收入口径），用户拍板；同比按 pay_date 年粒度，绑定 im_amt_yoy_diff/im_amt_yoy_rate 固化成员",
          "truncated": false,
          "rows": 0,
          "hitPreAgg": null,
          "audited": false
        }
      }
    ]
  },
  "raw_path": "rounds/m0/runs/cube/q03.raw.json"
}