{
  "id": "q23",
  "question": "汇总批次一共多少个？",
  "status": "answer",
  "metrics_hit": [
    {
      "measures": [
        "fiscal_allocation_view.count"
      ],
      "dimensions": []
    }
  ],
  "sql": "SELECT count(*) `fiscal_allocation_view__count` \nFROM  (SELECT * FROM (\n  SELECT * FROM (\n    SELECT * FROM (\n      SELECT t.*, c.chg_agency_name_canon FROM fne_funddivide_transfer t\n      LEFT JOIN (SELECT fchgagencode,\n                        arrayStringConcat(arraySort(groupUniqArray(fchgagenname)), ' / ') AS chg_agency_name_canon\n                 FROM fne_funddivide_transfer GROUP BY fchgagencode) c ON t.fchgagencode = c.fchgagencode\n    ) x1\n    LEFT JOIN (SELECT frecrgncode,\n                      arrayStringConcat(arraySort(groupUniqArray(frecrgnname)), ' / ') AS rec_rgn_name_canon\n               FROM fne_funddivide_transfer WHERE frecrgncode != '' GROUP BY frecrgncode) r ON x1.frecrgncode = r.frecrgncode\n  ) x2\n  LEFT JOIN (SELECT fitemcode,\n                    arrayStringConcat(arraySort(groupUniqArray(fitemname)), ' / ') AS item_name_canon\n             FROM fne_funddivide_transfer WHERE fitemcode != '' GROUP BY fitemcode) i ON x2.fitemcode = i.fitemcode\n) x3\nLEFT JOIN (SELECT frecsubcode,\n                  arrayStringConcat(arraySort(groupUniqArray(frecsubname)), ' / ') AS rec_sub_name_canon\n           FROM fne_funddivide_transfer WHERE frecsubcode != '' GROUP BY frecsubcode) rs ON x3.frecsubcode = rs.frecsubcode\n)  AS `fiscal_allocation`\nWHERE (if(empty(`fiscal_allocation`.`fcollectid`), '0', '1') = ?)\nLIMIT 1001",
  "sql_count": 1,
  "answer": "口径：按口径词典（2026-10-21 用户拍板，非 legacy）\"汇总批次\"= 清分记录中 collect_flag='1'（fcollectid 非空）的记录数，共 550 条。注意：按 fcollectid 去重的批次单数口径模型暂无成员、不支持，如需该口径需补建成员。数据范围为清分事实全量（未加时间过滤），无截断。",
  "errors": [],
  "elapsed_s": 28.0,
  "arbiter": null,
  "raw_path": "rounds/m0/runs/cube/q23.raw.json"
}